paper_id,title,pipe_d1,coder1_d1,coder2_d1,c2_vs_c1_d1,c2_vs_pipe_d1,pipe_d2,coder1_d2,coder2_d2,c2_vs_c1_d2,c2_vs_pipe_d2,pipe_d3,coder1_d3,coder2_d3,c2_vs_c1_d3,c2_vs_pipe_d3,pipe_d4,coder1_d4,coder2_d4,c2_vs_c1_d4,c2_vs_pipe_d4,pipe_d5,coder1_d5,coder2_d5,c2_vs_c1_d5,c2_vs_pipe_d5,pipe_composite,coder1_composite,coder2_composite,c1_c2_delta,note
P005,Securing the digital world: Protecting smart infrastructures and digit,10.0,10.0,10.0,EXACT,EXACT,3.0,3.0,3.0,EXACT,EXACT,4.0,2.0,0.0,ADJACENT,DISAGREE,10.0,10.0,10.0,EXACT,EXACT,10.0,10.0,10.0,EXACT,EXACT,7.05,6.65,6.25,-0.4,D3 0 (no connection): malware/intrusion ≠ financial fraud/corruption. More conservative than Coder 1 (D3=2) — domain mismatch is complete.
P010,Unleashing efficiency and insights: Exploring the potential applicatio,5.0,5.0,5.0,EXACT,EXACT,3.0,3.0,3.0,EXACT,EXACT,1.0,2.0,2.0,EXACT,DISAGREE,10.0,10.0,10.0,EXACT,EXACT,10.0,10.0,7.0,ADJACENT,ADJACENT,5.2,5.4,4.95,-0.45,D1 down 10→5: Q3 journal. D5 down: 60 cit 2023 = MNCS≈1.2 → Q2 → 7. D3=2 agreed (tangential accounting-fraud connection). Disagreement: pipeline D1=10 (Q1?) but journal is Q3.
P015,A Review of Neural Networks for Anomaly Detection,10.0,10.0,10.0,EXACT,EXACT,3.0,3.0,3.0,EXACT,EXACT,4.0,4.0,4.0,EXACT,EXACT,10.0,10.0,10.0,EXACT,EXACT,7.0,4.0,4.0,EXACT,ADJACENT,6.6,6.15,6.15,0.0,D3=4 agreed (RQ1 methods). D5=4 agreed (MNCS≈0.72 < 0.75). Full agreement with Coder 1 on all dimensions.
P020,DDoS Attack Detection in IoT-Based Networks Using Machine Learning Mod,7.0,7.0,7.0,EXACT,EXACT,3.0,3.0,3.0,EXACT,EXACT,4.0,2.0,0.0,ADJACENT,DISAGREE,10.0,10.0,10.0,EXACT,EXACT,10.0,10.0,10.0,EXACT,EXACT,6.3,5.9,5.5,-0.4,D3 0 (no connection): DDoS/IoT cybersecurity domain has no financial fraud angle. More conservative than Coder 1 (D3=2). D5=10 agreed (MNCS≈1.62).
P025,Anomaly Detection of IoT Cyberattacks in Smart Cities Using Federated ,7.0,7.0,7.0,EXACT,EXACT,7.0,7.0,7.0,EXACT,EXACT,4.0,2.0,0.0,ADJACENT,DISAGREE,10.0,10.0,10.0,EXACT,EXACT,10.0,10.0,10.0,EXACT,EXACT,7.3,6.9,6.5,-0.4,D3 0: IoT cyberattack detection ≠ financial fraud/corruption. Coder 1 gave D3=2 (tangential FL method). Key dimension-level IRR gap: scope of 'tangential' needs clarification in rubric.
P030,Edge-FLGuard: A Federated Learning Framework for Real-Time Anomaly Det,7.0,7.0,7.0,EXACT,EXACT,7.0,7.0,7.0,EXACT,EXACT,7.0,4.0,0.0,DISAGREE,DISAGREE,10.0,10.0,10.0,EXACT,EXACT,10.0,7.0,7.0,EXACT,ADJACENT,7.9,6.85,6.05,-0.8,D3 0: 5G IoT security ≠ government financial fraud. Coder 1: D3=4. Coder 2: D3=0. Largest disagreement in pilot set. Rubric clarification needed: 'tangential' vs 'no connection' for cybersecurity FL.
P035,Designing Unified Compliance Intelligence Models for Scalable Risk Det,2.0,2.0,2.0,EXACT,EXACT,3.0,3.0,3.0,EXACT,EXACT,7.0,7.0,4.0,ADJACENT,ADJACENT,10.0,10.0,10.0,EXACT,EXACT,10.0,7.0,7.0,EXACT,ADJACENT,5.65,5.2,4.6,-0.6,"D3=4 (one RQ: RQ3 scalability). Coder 1: D3=7. Disagreement: Coder 2 sees RQ3 only substantively; RQ1 only tangential (SME ≠ government context). D1,D2,D4,D5 agreed."
P040,A systematic review of anomaly detection in IoT security: towards quan,2.0,2.0,2.0,EXACT,EXACT,3.0,3.0,3.0,EXACT,EXACT,10.0,4.0,0.0,DISAGREE,DISAGREE,10.0,10.0,10.0,EXACT,EXACT,7.0,7.0,7.0,EXACT,EXACT,5.8,4.6,3.8,-0.8,D3 0: IoT+quantum anomaly detection → zero financial fraud content. Pipeline D3=10 (severe over-score). Coder 1 D3=4. Coder 2 D3=0. All three differ — this dimension needs explicit rubric anchor examples.
P045,FinChain-BERT: A High-Accuracy Automatic Fraud Detection Model Based o,2.0,2.0,2.0,EXACT,EXACT,7.0,7.0,7.0,EXACT,EXACT,4.0,4.0,4.0,EXACT,EXACT,10.0,10.0,10.0,EXACT,EXACT,7.0,4.0,4.0,EXACT,ADJACENT,5.6,5.15,5.15,0.0,"Full agreement with Coder 1: D1=2, D2=7, D3=4, D4=10, D5=4. MNCS≈0.5 confirms D5=4."
